{
    "version": "1.0",
    "telemetry_url": "{{ env['PAYU_TELEMETRY_URL'] }}",
    "telemetry_proxy_url": "{{ env['PAYU_TELEMETRY_PROXY_URL'] }}",
    "telemetry_token": "{{ env['PAYU_TELEMETRY_TOKEN'] }}",
    "telemetry_service_name": "{{ env['PAYU_TELEMETRY_SERVICE_NAME'] }}",
    "hostname": "{{ env['PAYU_TELEMETRY_HOSTNAME'] }}"
}